回到家迫不及待开箱验货，颜值美爆了，开机速度5秒，没有一点噪音，速度超级快，办公娱乐都很哇塞，惠普绝对可靠，期待后续使用，运行速度：快，屏幕效果：完美，散热性能：棒，外形外观：一级棒，其他特色：办公娱乐轻松拿下,3
送机速度挺快的，开机速度也快，总体颜值很高，特别美观，简约风，我很喜欢，电脑很轻，便于携带，客服的态度非常好，续航能力不错，可以玩一上午，喜欢的姐妹赶快下单吧！，屏幕效果：好，外形外观：巨棒，轻薄程度：薄,3
电脑还可以指纹解锁。非常棒！很喜欢，电脑性能好。颜值也特别高。很好看。鼠标的灯有好几种颜色。特别喜欢这台电??，屏幕效果：很清晰的，轻薄程度：很薄。方便携带,3
运行速度：挺快的，屏幕效果：清晰度和分辨率都还不错，散热性能：还可以，外形外观：很好看，配色很好，轻薄程度：轻，其他特色：个人觉得还是很好的，很值得购买,3
电脑收到了，包装的很好，完好无损，客服的服务态度超级好，很耐心电脑屏幕适中，很便携，屏幕清晰，客服真的超级棒，很热情敬业。,3
电脑非常好用，非常薄，适合办公携带，，颜色粉色但是不是妖艳的粉色，非常好看，性能非常好，不卡，日常的办公毫无压力。，颜值也和也很高，适合年轻人使用。，惠普电脑 值得拥有,3
电脑粉色的很好看。然后音质也很好。视频也很清晰。显示器也很大。触感很舒服 指纹也很灵敏 键盘大小也特别舒服。客服也很好。很耐心的回答我的问题。回答我也很快 很喜欢客服也很喜欢电脑 perfect,3
电脑很好，很轻薄，女孩子用起来很不错。速度很快，也许因为是新电脑吧，系统很干净。散热也很好，因为没玩大型游戏，用起来很爽。，总之，电脑很不错。,3
外形外观：外形外观：颜值一百分 很适合女孩子 ，轻薄程度：很轻薄，散热性能：目前来说还不错，屏幕效果：很赞 很舒服，运行速度：键盘很不错 操作很流畅 指纹解锁也很快，其他特色：电脑包和鼠标都很普通的那种 打算另外再买,3
电脑今天刚拿到 外观很好看 很喜欢 ，颜值较高 。除此之外 我买的是银色 ，没有色差 ，颜色很正 。这个价位拿到这样的电脑 我很满意 。开始使用的时候 电脑反应速度很快 ，非常nice 。,3
售后服务很好，电脑也很棒，快递也很快的，客服沟通很亲切，超级喜欢，电脑很顺畅的，开机很快，超级喜欢客服的服务,3
活动买的非常优惠，运行速度：很好，很满意，很喜欢，值得购买。，用着也不卡   建筑系买的   还不错  推荐,3
电脑收到了，非常喜欢，电脑开机快，第一次开机，有简单的安装步骤，方便快捷，一次不错的购物体验！！,3
早就相中了这款电脑～现在毕业啦，可以满足拥有属于自己的小电脑啦，真的超激动期待鸭～收到货，真的惊艳到我了，电脑性能这方面不用说，指纹解锁一键搞定，安全性能敲级好，质量这方面也不用说，惠普也是知名品牌，根本不需要担心这些。电脑不仅轻巧薄，而且颜值还特别高！特别是粉色的，特别适合女生，真的满足了我的小小少女心鸭！！！哈哈哈，有问题客服姐姐也超级耐心的给我解决指导，物流也快，包装严实，也没有破损的地方。总之就是很满意的一次购物！！！,3
买回来用了十来天，感觉非常不错，体积小，不重，非常适合女生，CPU是目前比较高端的，这款还带了英伟达，运行速度快，一点也不卡顿，强烈推荐,3
运行速度：速度没得说，最新11代i5，日常软件都很快。，屏幕效果：高色域屏幕看电影很不多，雾面屏不反光。，外形外观：外观是选了好久的，给媳妇儿选的粉色的，金属外壳很有质感。，轻薄程度：两斤多点算是很轻薄了吧。,3
客服非常友好，有问必答，回答也很耐心细致，发货速度很快，到货也快，收到后两层盒子包装，内层包装十分完好，电脑颜值很高，可控背光键盘亮点，试运行了几天，速度很快，目前来讲，还是很不错的！,3
发货及时，包装很好，电脑很不错，是我喜欢的小巧，精致。开机非常快，运行声音几乎听不到到，因本人对电脑一敲不通，联系卖家也是非常热情，一次不错的购物！,3
包装的很完美，好几层加固，粉色的外观简直爱了，好看的一批，，客服小姐姐也态度很好，各种问题都帮我解决了。，运行速度：也很快,3
运行速度：很快，屏幕效果：很高，散热性能：很棒，外形外观：很美观  超级喜欢，，轻薄程度：轻薄，其他特色：很适合学生党,3
很喜欢惠普的笔记本电脑，首先我买的电脑是粉红色的，外观很好看，对我这种很喜欢这种少女粉的人来说，真是太太漂亮了，很满意。 其次，性能，因为主要是学生在用，平常也不用打什么大型的游戏，就是来看看电视剧，偶尔用一一下而已，所以这方面没有什么太大的感受，等用过一个月后再来追评。 再者，关于重量，我觉得还行，不是太重，尺寸耶刚刚好。 散热还是可以的，最大的优点是充电很快!满意好评！,3
这个颜色很喜欢，摸起来质感不错，非常值得信赖的品牌，质量有保障，相当满意刚好做活动，价格便宜了很多，性价比超高，真的特别划算产品质量，客服服务态度特别好，很喜欢，好评,3
轻薄程度：很便捷，很轻携，很适合女生的的一款初恋粉。，外形外观：很简洁，整体挺好看的，侧面看着挺好看。主观很适合一些简单风格的人。，运行速度：打游戏的话不卡，挺快的，作图，PS，CAD一些专业的应用，都可以的。,3
第一次买电脑，选了很多，最后选择了惠普，果然没让我失望，这个电脑尺寸很好，很适合我小小的，然后也可以指纹解锁。客服也很认真的给我解说你给我安装了一些软件，然后开机的速度也很快，几秒就开机了，颜值也很好，所以信赖惠普。，运行速度：快，屏幕效果：好，散热性能：可以，外形外观：好看，轻薄程度：薄，不重,3
非常的好 性价比也好 服务态度也非常好 很流畅 包装很好 用了一上午，质量没问题，值得信赖的商家，优秀的客服，有问必答，开心的购物旅程！有需要下次一定还回来购买，最优秀的商家，你会越做越好的。诚信商家，大家可以放心购买！信誉保障！，外观材质挺大气的，新款式，不错显卡效果曲平的，看着很清晰，屏幕也足够大了，配置还挺好，运行流畅，***，比实体店便宜了很多，音质号，运行速度快，开级速度也很快，发货快，服务热情，超级有耐心，非常非常满意,3
电脑收到了，首先就一直很喜欢电脑的外观，第一次开机，有简单的安装步骤，方便快捷，特别适合我们女孩子，能简单快速的进入到使用页面，屏幕给人很大气的感觉，也比较轻薄，方便携带，棒?,3
运行速度：用了一段时间，速度可以的。，屏幕效果：挺好的。，散热性能：散热可以，偶尔听到风扇的声音，声音不是很大。，外形外观：淡淡的粉，很少女心，这款很适合女孩子。，轻薄程度：可以。，其他特色：整体来说，都可以。目前还没发现什么毛病。,3
笔记本到手颜值超高 银色很漂亮，客服服务态度很好 快递包装很完整 没有磕碰，电脑保护的很好 还赠送了电脑包鼠标，轻薄程度：电脑很薄 很轻 携带方便，屏幕效果：显示度高 很清晰，运行速度：初次开机时间会长一点 其他运行速度很快,3
之前一直在留意，一直没有下手，最终还是买了这款，到货之后简直喜欢的不要不要的，颜值担当，太喜欢了，刚买回来，不怎么会使用，全部靠客服的耐心讲解，服务态度非常满意，爱了爱了，实在是喜欢，没有后悔，下次还来。,3
轻薄程度：很轻薄，外形外观：非常好看，高级，屏幕效果：显色很好，散热性能：散热快，不发热，其他特色：快递物流除去疫情等不确定因素的话还是很快的，我的快递由于疫情原因滞留了10天，今天才到，包装还是很不错的。,3
十分好看 很适合学生用 而且服务态度非常非常好  是一个超级好的商家  希望大家多多光顾,3
电脑真的很不错！散热也挺好的也特别快，感觉很方便也挺薄的又轻便适合女孩子而且好看，赞赞赞?,3
电脑做得精致，手感特别好非常满意，非常适合学习办公使用，关键颜值高，我特别喜欢运行速度，还可以喜欢就下单吧。重量也不是很重，方便携带小巧，轻便机身是金属的。,3
外形外观：非常喜欢，很适合女生，轻薄程度：很轻便，屏幕效果：很清晰，，个人还是比较满意的，用来学习，追剧，打小游戏完全合适，使用体验感不错，客服也很有耐心。,3
客服很耐心，一步一步教你。里面办公软件基本自带，外观超薄，颜色粉很洋气。太符合女生标淮了，速度也是超棒的。满意满意！喜欢的可直接入手。我不是拖。,3
银色很好看，键盘一闪一闪的，散风性能也很好，反应速度也很快，总之很满意！,3
电脑颜值超高，入目淡粉色不俗气，机身小巧可爱装入我的帆布包完全没问题，内存1000.G超级大盘，下载软件很快，音质不错，非常轻拿起放下很舒服，总体比较满意！，还在等软件工程师给我激活office软件，用一段时间再追评吧。,3
超级好哦 轻便  ?开机速度特别快  适合学生用  记得当时我急着用 他们从南京发货 第二天就到啦真的很感谢呢  ，  用了好长时间才过来评论  特别好用哦 散热声音也不太大  不卡 不黑屏 不是翻新机 指纹解锁 你值得拥有  颜值也超级高哦?,3
散热性能：非常快 ，运行速度：非常快，屏幕效果：一个字&ldquo;绝&rdquo;，外形外观：外观有点粉我非常喜欢，轻薄程度：非常轻薄，其他特色：非常漂亮，喜欢的集美们不要错过欧,3
看了好多家，对比了好多，最终还是选择这家，收到没有失望哦，很喜欢这个笔记本电脑，用起来也没有卡顿的现象，运行很流畅，我是用来办公的，基本够用，很好,3
真心挺好的，性价比也挺高的，用的也很流畅。小巧便捷。才拿到，感觉非常不错，屏幕分辨率也挺好的，很清晰，客服也很好，及时回答问题。物流也还蛮满意的。相当不错，值得购买。,3
运行速度：可以，快，屏幕效果：屏幕清晰，高色域，散热性能：也很好，我就看看电视，我不打游戏学设计的觉得够了，外形外观：银灰色很好看，轻薄程度：不厚，很轻巧，好用，其他特色：很轻，适合女孩子用，耐看，好看 推荐，这个价位感觉还可以，我也不懂，目前都很好,3
运行速度：很棒，屏幕效果：很棒，外形外观：爱死了，其他特色：键盘灯我爱了呀，可以调节的，按f11，成像也很清晰！支持代言人！！！蔡徐坤好帅！惠普好优秀！完全满足大学生的基本要求！！！姐妹们冲鸭！！！！,3
外形外观：很好看，标准银，轻薄程度：挺薄的，很喜欢，自己很喜欢，回来包装很严实，送了商务型电脑包，带了鼠标垫，鼠标和充电器。系统安装特别详细，很快安装完成。总的来说，很满意,3
我是今年的高考考生，选择了这一台电脑，使用了十多天，非常流畅，并且运行速度还很快，屏幕清晰，没有杂质，总体来说非常不错，还是很薄的，携带也比较轻，比较方便，推荐大家进行购买。！,3
非常轻薄的一款笔记本，快递包装很安全，没有损坏，开机速度挺快的，各种按键灵巧舒适，桌面很清晰运行平稳。,3
颜值很高哦！美观简单大方！，很轻薄，方便携带！，背光键盘很给力哦，好看又便利。，屏幕大小比例很合适。喜欢～，? ? ? ? ? ?,3
京东物流还是快啊，比预期的快了一天。机子很薄，开机速度很快，差不多就10秒，达到预期。客服态度很好，帮激活了office，和分盘。对于电脑小白来说是不错的服务。,3
商品收到了，孩子非常喜欢，也好操作孩子看着步骤自己就把文件存好了，现在孩子就可以上网课了，非常好,3
开机速度挺快的  很薄 带着非常的方便 办公学生党都非常的实用 屏幕也很大 够用了 很清晰 键盘非常的喜欢 爱了，外形外观：非常好看 适合女孩子,3
运行速度：开机十秒内，系统运行流畅，屏幕效果：细腻亮丽，色彩饱满，散热性能：声音很小，效果很好，轻薄程度：较为理想，外形外观：外观沉稳而又不失典雅，奢华而不张扬，其他特色：全金属外壳，质感,3
运行速度：运行速度非常流畅，适合日常办公。，屏幕效果：屏幕效果非常高清，画质很清晰，散热性能：散热性能也很好，目前用了6个小时左右没有较大的发热，外形外观：粉红色的外观非常适合女生，少女感爆棚，轻薄程度：一只手可以拿起，适合外出携带，其他特色：赠送礼品非常丰富,3
颜值没得说，超薄轻便，方便携带，开机就有指导注册，很方便，速度很快，非常不错,3
电脑很好用，开机速度快，使用流畅，是**买了反馈不错所以买了，配置可以，学生党完全够用，画面音质都不错，推荐，,3
外观干净漂亮，做工很不错，没发现什么瑕疵，个人感觉大小也挺合适，找了很久选的这款，大爱！到货就迫不及待打开了，果真没有让我失望，质量特别好，颜值也相当高，满意的一次购物。客服人真的很好，我真的是电脑小白，客服很有耐心一点一点教我使用很棒很感谢！,3
从下单到收货三天时间，终于等到了，开箱果然没有令我失望，颜值爆表，功能强劲！好样的，惠普。曾担心快递运输问题，因为京东，所以请放心！,3
刚拿回来，包裹的很严实，灰色的很漂亮。，激活也很快，开机也很快。，下载了视频软件，很流畅！，不错哦，而且客服也很有耐心！，使用一段时候以后，还会追评的！,3
小本子已经收到特地用了几天才来评价，本子轻薄很适合随身携带，运行速度很快，款式也是我喜欢的,3
工作电脑是惠普的，很不错，于是自己用的也想买惠普的，之前看的战66，后来涨价了，这个正好有活动就买了，配置和战66一样，价格也一样，颜值也高，配置也很不错，惠普大品牌，值得信赖,3
首先颜值高，非常轻便，超薄款，特别适合女生出门携带办公，初次使用会有提示操作非常方便，开机和运行速度都很快,3
电脑不错，大小可以接受，13.6寸，女生携带很方便，客服态度也不错，希望以后用的流畅，给个好评吧！,3
很符合我的预期，电脑尺寸是14英寸的，很小巧轻便，颜色也很好看，键盘还会发亮，运行速度很快，还可以设置指纹解锁，很方便，只是拍出来的颜色比较浅，很喜欢哦,3
可以的 看了很久最后在这家店买了 背光键盘真的超级好看晚上效果更佳,3
机子手感很好，很沉手，外观是金属的，颜色正，开机速度很快，没有噪音，客服态度好，很有耐心，我一个电脑小白也可以自己分盘了，给好评哟！,3
很合适 大小合适 用了一段时间使用感受也很好 客服也很耐心教 总的来说很好，外形外观：好看，轻薄程度：很轻，散热性能：不热,3
笔记本电脑很棒，颜值爆表，外观时尚而且很有质感。屏幕分辨率高，色彩饱满，画质很好，音质不错，立体音饱满。用起来很舒适。最重要的是，运行速度很快，一点都不卡,3
运行速度：一点都不卡，很流畅，屏幕效果：范围感直接拉满，外形外观：我选的银白色，很好看，绝键盘背光设计特别好看??,3
电脑性价比挺高的，外观也挺好看的，用起来也很流畅很适合学生使用。，运行速度：比较快，屏幕效果：比较好，外形外观：非常不错14寸的。，轻薄程度：轻薄好携带，散热性能：散热挺好的。，客服非常耐心解答很好。并且非常好沟通不知道的地方问了他会很好的解说帮助,3
宝贝很好很满意，月初买的，已经用了半个月了，来评价，很喜欢，小巧以后出门可以随身携带了，很满意，实拍图喜欢可以下手呢，看了好久才选中这家，总体不错,3
帮同事购买，对惠普比较喜欢，所以也推荐同事买惠普笔记本。拿到后感觉实物比图片强上的还要好，手感好重量轻，反应速度超快，整体表面金属拉丝面板，同事用了很喜欢。使用几天后再追加评价。,3
电脑超级好用，反应快，外观精美，电脑便携，轻巧，运行速度：快，屏幕效果：好，散热性能：不错，外形外观：超赞?，轻薄程度：便携,3
运行速度：非常快，对比了很多家，还是选择了惠普，因为我不打游戏，运行速度还是非常快的，一点也不卡，真心推荐，，屏幕效果：很清晰，我刚开始没想到会那么清晰，跟同学电脑对比了之后，散热性能：好，外形外观：我喜欢的颜色，他们家的这个颜色真的是爱了，我买的是十四寸的，对女生来说，刚刚好，不大不小，轻薄程度：很轻薄，我挑了好多天，觉得自己这次买到自己喜欢的了。,3
简直爱了，屏幕效果：看着眼睛很舒服，，运行速度：速度快 使用方便，外形外观：大小合适，外观也好看，刚好适合学生党用，轻便，，其他特色：总之我非常喜欢，正合我意，客服服务态度较好，有耐心，发货速度也快，很是喜欢，喜欢的宝贝抓紧入手噢?,3
包装严实，物流很快，粉色的颜值也很高，强烈推荐入手，键盘会发光，很好快，开机速度也不错?，轻薄程度：不错，外形外观：非常漂亮，满足我的少女心,3
还很轻，大小大概比A4纸大一点点。刚拿到手，什么都不会，幸好有开机指导，很方便。开机什么都挺快的，感觉挺不错。送的鼠标摸上去也很舒服哦。一次不错的购物体验！,3
开机很流畅，还有语音助手帮助我设置电脑，粉色的，我很喜欢，客服回复的速度要是能再快一点就更好了，,3
电脑颜值确实很高，女生用起来轻巧方便，这个配置办公已经是相当好了，遇到有些东西不会操作，电脑的售后反应速度也很快，态度不错，解决问题也很好，比较满意。,3
电脑昨天就收到了，然后现在才打开看到。，  首先就一直很喜欢电脑的外观，第一次开机，有简单的安装步骤，方便快捷，特别适合我们女孩子，能简单快速的进入到使用页面，屏幕给人很大气的感觉，也比较轻薄，方便携带，  客服也很好说话的，有问题找也能够及时的解决 不懂的地方也能够问客服。，  还配套了鼠标和鼠标垫、包,3
运行速度：开机5秒，瞬间完成开机，自带的正版office软件，省了不少心，打开word什么的非常快，外形外观：很好看，喜欢键盘灯，很高级，键盘敲起来很有质感，轻薄程度：特别轻巧，女生一只手拿着没问题，而且还特别薄，其他特色：新机器收到后，会有语音提示，一步步指导操作，还有个步骤需要设置pin，其实就是开机密码～?,3
电脑收到了，就一直很喜欢电脑的外观，第一次开机又简单的安装步骤，方便快捷，特别适合女孩子。能简单快速的进入到使用页面，屏幕给人很大气的感觉也比较轻薄，方便携带，很棒，颜值没得挑，很漂亮，画面清晰，办公娱乐很方便。爱了爱了?,3
非常满意的一款，开机是秒开，机身轻薄，窄边框，非常有质感，使用流畅，手感好，还能指纹解屏，强推强推！,3
运行速度：棒棒哒。，屏幕效果：超级好看(??&omega;??)??。，散热性能：跟我原来那个笔记本相比这个真的很棒，不热。，外形外观：背光键盘超好看，粉色的盖子。适合小仙女嘿嘿。摸起来冰冰凉凉的很滑，材质很好。，轻薄程度：很轻。，其他特色：完美的一次购物。(??&omega;??)??,3
首先电脑外观上很好看，在审美点上。其次电脑很轻巧，外出办事什么的带着很方便，一个小包就能装下。电脑的反映还是很快，散热也不错，没有打游戏，对于日常办公来说，绰绰有余。办公室用电脑也不太占空间，小巧美观。,3
选了半个多月的电脑，最后还是选择了惠普星14，轻薄本果然名不虚传，而且外观设计也很nice！背光键盘深得我心，快递包装的很好！系统预装了win11，感觉非常不错，客服有问必答，大家可以冲一波！,3
收到货后很期待，包装很好，两层盒子，机子外观很漂亮，还送了鼠标，电脑包，鼠标垫子，按程序开机，还有语音提示 ，完美开机，电脑很小巧，方便携带，散热性较好，推荐购买。,3
轻薄程度：一拆开外包装就被惊艳到了，非常轻薄，很适合女孩子，外出再也不怕重啦，外形外观：在粉色和银色纠结了很久，最后选择了银色，大气简约时尚，运行速度：速度非常快，性能效果非常好，屏幕效果：屏幕分辨率都很不错，散热性能：散热性非常好，用了很久也没有发烫。，值得购买，品质与时尚兼具。,3
&bull; 本子很薄，使用也很流畅，外观简单大方，&bull; 客服小狸很敬业，收到本地第一时间就联系了，解决了一些问题，&bull; 和之前用的联想操作系统不一样，目前这个好用,3
电脑很便携，风扇基本没有声音，分辨率很好，店家服务态度很好，我问有没有电脑包送，他们说客服可以送，然后给我送了黑色的电脑包，好评^&omega;^,3
粉色非常好看，首次开机有人工智能辅导注册，联网，使用几天感觉非常好，运行速度快，画质清晰，机器轻便，非常好?,3
外形外观：买的粉色，心中本来有点忐忑，拿到之后很惊喜，是很高级的粉色，很喜欢。，屏幕效果：屏幕画面很清楚。，电脑很棒，可以指纹开锁，还送了鼠标，鼠标垫和电脑包。客服姐姐态度很好，我第一次买电脑问了很多问题，客服都很耐心和我交流。,3
很时尚，学生用足够了。激活也很简单，傻瓜式，适合女生?,3
用了一段时间才来评价 电脑很轻也很流畅 背光键盘我简直太爱了！！！颜值超级高然后画质也很不错！！！冲就完了！！ 喜欢喜欢,3
首先，外观是粉色的，很适合女生，很好看，其次轻薄本 很轻，很方便携带，然后反应速度也还可以，还送了一个鼠标,3
收到商品测试了几天，整体感觉非常不错，这是第二次购买惠普笔记本，第一次买的是envy13，用了三年，现在还正常使用，下面点评一下这台星14的使用感觉，一、屏幕是高清屏，高色域，视觉非常舒服，这屏幕是LG的，这是我选择笔记本的第一要素；二、特意选择了16g内存，512g硬盘，2g独立显卡的配置，虽然平常不怎么玩游戏，选择这个配置也是为了有时多开程序时，系统可以流畅运行，鲁大师测评29万分，非常不错；三、此款笔记本轻薄，携带起来很便利。,3
用了几天了。挺满意的。没到之前还有点怕翻车。结果感觉我的担心有点多余了。比预想的要好很多。外形轻薄 科技感足。磨砂手感也很好。立体音效，听音乐看电音也很享受。,3
运行速度：还挺快的，比我之前那个电脑快多了，开心，屏幕效果：看起来不错，挺舒服的，散热性能：看了一会，没怎么发热，外形外观：这颜值太好看了，淡淡的粉色，很适合女生，轻薄程度：对我来说已经够了，不是很重，其他特色：这个键盘我也挺喜欢的，总体颜值特别好，我也不打游戏，对我来说已经够了。,3
上一台买的是惠普这次还是选惠普，轻薄，颜值高，开机速度也很快，噪音也很低，手感很棒,3
评价来晚啦～收到电脑已经有一星期多了，拿到的当晚就进行了系统安装，然后就投入工作使用了，使用过程中一切都挺流畅的，休息的时候用它追个剧，画质非常好，色彩各种都很棒！！,3
电脑很好  很喜欢   我纠结了好长时间  最终还是选择了这个  果然没有失望 而且也很方便,3
