非常棒的电脑 i5的，本人用的是20版matebook14，所以给爱人买了这台，颜值非常棒，简单办公娱乐，主要是正版office办公软件，值得拥有。,3
品质做工：做工精细，质量很好，款式时尚大气，很满意的一次购物！，轻薄程度：适合需要出差旅行的。，外形外观：简洁美观。，屏幕效果：显示屏效果很好。,3
华为这电脑，非常的好。14寸刚刚好。运行速度，非常的快。屏幕效果还可以接受。散热性能很不错。外观很酷，高大上。这个厚度可以接受啦。初体验还不错，华为分享功能很不错。价格也非常的优惠，京东送货到家也挺快的。,3
电脑很轻薄，操作灵敏，很满意。质感也很上档次，比之前用的苹果电脑好操作，华为真的很牛啊，之前用的华为手机，现在电脑也入坑了，国货牛啊，会一直支持的。送货速度也是绝了，第二天下午就收到了,3
整体来说还是很满意，日常办公完全足够，使用一段时间再来追评，只有裸机和充电器，鼠标电脑包得另外下单买，还没有到货,3
这个操作模式不一样！用习惯了以前的操作模式！现在这种操作模式暂时用不明白！电脑很薄！感觉很轻盈！，运行速度：挺快，屏幕效果：挺好的，散热性能：有的时候会有风扇的散热的声音,3
运行速度：超级快。，屏幕效果：屏幕效果：清晰。 ，散热性能：散热性能：特别好。 ，外形外观：外形外观：非常好。 ，轻薄程度：轻薄程度：轻薄。 ，其他特色：其他特色：电脑的拍照，摄像头藏在电脑键盘里。,3
收到啦，整体很喜欢，开机还挺快，现在还在慢慢摸索中，特别是充电器，轻便，喜欢,3
深灰色，外观很有质感，拿着也很沉句甸，开始充电很快，画面清楚，本以为键盘会很小，但是没有，够大，屏幕也不刺眼睛，操作流畅，适合上课办公人士！,3
运行速度：杠杠的，屏幕效果：很大很护眼，散热性能：没感觉烫，外形外观：很高颜值，轻薄程度：又轻又薄很牛，其他特色：华为互联太方便了,3
头天下单，第二天就收到，京东快递就是快，包装也完好无损，一如既往的喜欢?华为，开机秒开，使用很顺畅，对于不完游戏的我这款已经够用了，，运行速度：超快，屏幕效果：非常好,3
宝贝收到，一如既往的好，包装很到位，笔记本电脑颜值很高，大小合适而且很轻薄，运动速度很流畅。,3
同学买的这款说好用，推荐给我的，昨天晚上下单今天中午就收到货了，外观好看，开机也快，，运行速度：很快，屏幕也很清晰，散热还可以，,3
外观和质感都很满意，华为电脑管家非常实用！灰色大方漂亮值得多等几天。总之非常满意！支持华为！,3
很简洁，干干净净的感觉真好，里头也没有乱七八糟的软件，比较实用。开机速度快，散热好。比较喜欢。就是华为的商标太朴素了，就几个大拼音字母。,3
这款笔记本非常不错，外形轻薄美观，运行速度很快，操作方便，音质也好，性价比还是比较高的，会一如既往地支持华为，支持国货！,3
颜色很好看，简单大方，物流非常的快，客服服务态度很好，快递员小哥服务态度很好，这款电脑里面有个小型隐形摄像头，而且可以跟华为手机进行互动，十分的nice，爱了爱了，推荐大家购买。,3
刚好要换电脑，看中了这款新款的华为2022版本，预售几天就到手了，拿到拆开非常满意，值得推荐。系统用不惯，准备重装win10的,3
开机速度非常快，外观设计超值，wendos系统是新版的，不太熟悉，用起来，整体目前效果还不错，尤其是小喇叭?,3
真的很轻薄，不卡顿，客服态度很好，解决问题，客服回复快，外形外观：颜值担当，轻薄程度：轻薄小巧精致，很适合外出带，适合女生，运行速度：不卡顿，特别快,3
性价比高的一款电脑，办公非常适合，机身超薄，携带方便，华为就是强，京东就是给力，过年不打烊,3
因为是电脑小白 很多问题不明白，客服也一直在耐心的服务，售后满意度满意度百分百。电脑运行速度也很爱，主要是这个价格性价比真的是太高了??，轻薄程度：超级轻薄，外形外观：美观,3
一直喜欢华为的电脑，我买过一个荣耀的，使用三年了，一点也不卡，还是非常好用的。所以，买给我妹这个华为的。，这个款针对学生，价格实惠，运行速度很快，散热也还不错。外形好看大方，充电器手机电脑通用，而且充电速度超快。14寸的，也非常便携。,3
一如既往的信任京东，打开包装笔记本惊艳到我了，做工质感都很好，很喜欢，买了给女儿上网课用的，运行流畅，屏幕清晰！必须五星好评！,3
物流太快了，午休时送到，瞌睡没得了，立马开机，速度飞快，顺利激活office，连接手机很顺畅，win11还在摸索。第一次买华为笔记本，质量上乘，非常满意，华为加油！,3
笔记本颜值很高，小巧轻便，方便携带。，运行速度：很快。，屏幕效果：很合适。，散热性能：优秀。，外形外观：很漂亮。，轻薄程度：很薄很轻方便携带。,3
心心念念的笔记本电脑终于到啦(((o(*?▽?*)o)))电脑外形非常显档次，外壳摸上去手感很好，是正品。与图片描述相符，运行速度：还行,3
首先收到电脑打开一看颜值不错，喜欢，接着就是用下来的感觉很顺畅，键盘灵敏，用来办公感觉很不错，推荐购买yyds,3
非常棒！刚收到电脑激活，很简洁，不像之前的自带很多不需要的软件，还要自己去清理，指纹解锁是个很不错的配置。各方面反应都很不错！办公本推荐！,3
运行速度：很快，屏幕效果：很好，散热性能：使用半小时到一小时几乎没有发热，外形外观：银色，很好看，轻薄程度：比较小巧轻薄,3
买了两台，给公司当办公机器用，速度很快 系统也好用，就是不知道华为笔记本啥时候上鸿蒙系统，很期待，手机的鸿蒙很好用，电脑的也不会差吧？,3
非常棒，非常满意。不愧是华为，也是，好不容易抢到灰色的，也很好看。虽然是低配版8G的，但是我只需要办公使用，完全没有任何压力。就很棒??,3
买了办公用，性价比很高。很有质感，做工不错，屏幕素质很好。边上没有割手感觉。开机键和指纹识别一起，很方便。,3
除了粘指纹，日常用还挺好，我就简单做下表，看电影，对我来说足够强大了。颜色紫灰，很漂亮，手机拍不出来。,3
外形外观：外观很好，，轻薄程度：很轻薄，屏幕效果：很好，运行速度：运行速度：开机比较快，用着也比较快,3
前天下单今天就到了，录了开箱视频，包装还是很nice的！银色真的好好康！游戏本用惯了，感觉商务本好轻薄啊！话不多说，上图！,3
非常轻薄，外观大气，颜色很正，非常大气耐看，大小合适，速度也特别顺畅，物流也很快，购物会陆续追评，最主要的是性价比超高,3
运行速度：非常快，屏幕效果：非常清晰，观看眼睛舒服，散热性能：非常凉快，外形外观：简约大气，好看，轻薄程度：拿在手上很轻，其他特色：以前就差个笔记本就全家桶了，现在华为全家桶，非常好用,3
原来电脑都要散架了，各种需求综合就看上了这款。可180度开合的屏，typeC轻便电源，金属外壳，基本预装的office也不缺。总体很满意。,3
运行速度：超级快，超级简单，屏幕效果：鲜艳靓丽，柔和一点更好，散热性能：感觉不到发热，外形外观：简约时尚，轻薄程度：是想象中的重量，特别是一个充电头加一根线就完事，没有拖沓，其他特色：鼠标也不配一个，买了个无线的，激活用触控板操作半天,3
华为真的非常棒哦，开机非常快，画展清晰，不愧是国货，很开心没有踩雷，总体是比较满意的，自己也是看了很久选择的，非常相信华为，下次再来,3
因为要上网课买的电脑，已经使用快两个月了，用起来很流畅，很好用，运行速度不错，屏幕清晰，散热好，外观也不错，比较轻薄，到货快，第二天就到了。,3
华为真的是国货之光，必须支持国产，手机，手表，电脑都是用的华为的，质量没说的，电脑非常清晰，运行流畅，超薄便于携带，五星好评！,3
华为笔记本首先外观很高大上，薄薄的，颜值在线。其次配置也符合现在大多数人的需求，大内存大硬盘。最后就是情怀了，国内知名品牌必须要支持。,3
今天凌晨付款的现在就拿到货了，迫不及待的开机，比我想象的要薄一点，屏幕也漂亮边宽很窄，颜色很很正，超级爱了。自己相信的品牌，质量有保证。下一步把其他的配置整齐。,3
电脑的可视角度比较高，外观也很好，银色很漂亮，HWYYDS，这个价格买到这个配置+外观已经非常不错了，希望2022发发发,3
支持国货，支持华为！轻巧，精致！更令人惊喜的是摄像头藏在按键里，问了客服才找到。刚用了一天，满意！还要支持京东，次日达，超赞！，外形外观：精致，轻薄程度：超薄超轻,3
昨天下单，今天到货！激动的打开之后，被其颜值惊叹！手感极好！运行速度很快！屏幕美观，不易眼疲劳！散热性能好！轻薄易携带！信赖华为！支持华为！,3
非常棒，开机速度快，运行非常流畅，内外包装完好，电脑电池很耐用，续航时间满意；还带有指纹解锁，很便捷，14寸的屏幕，办公的话大小合适；有一个缺点就是流浪器文字很小，浏览起来不舒服，其他完美。,3
轻薄程度：轻薄，装在公文包里刚好，适合带出差，运行速度：开机挺快，指纹解锁很方便，散热性能：不怎么热，挺静音的。，总体上性价比很高。如果能直接送鼠标就更好了。,3
第一次在网上买笔记本电脑，超级满意，运行速度快，而且真的超轻薄，跟一个本子一样，散热快，运行很久也不会发热。推荐购买！！,3
宝贝很快前天下单昨天就收到了，电脑很有档次，颜色也很好看很正，质量看起不错，也很轻薄，用起速度也很流畅,3
运行速度：挺快的，开机关机都很快，外形外观：好看很轻薄，服务态度很好，快递很快而且快递小哥很有礼貌，对待快递也是轻轻的，录了一个开箱视频，没有什么问题，就是这个设置时间是什么意思不太懂,3
很漂亮的一款笔记本，在网上比较了很久，感觉这款吧还不错，同事用了两天，感觉速度很快，很好用。屏幕对眼睛不刺激，色彩丰富，键盘手感不错，同时其他部位触感好。,3
挺不错的笔记本，外观很轻薄，配置高，i5+16G+512G固态，锐钜显卡玩玩普通游戏都够，屏幕是1080P的，办办公很不错。,3
非常好用，轻捷方便携带，开机非常快，用了几个小时，也没有发热，散热系统非常好，第一次买电脑，赚到啦，没有踩雷，客服非常好！！！,3
非常满意的一次网购体验，现在我已经全部是华为产品了，哈哈，手环，手机，电脑，做工很好，运行速度快，发货迅速，棒棒哒！必须赞一个！,3
金属质感很好。14寸蛮小的。屏幕可以开启180度，小米跟华为之间纠结半天还是买了华为。,3
非常期待的收到了我的本本，外观颜色好，完好无缺，很薄很轻，显示屏显示细腻，护眼屏就是不一样！,3
运行速度：运行速度：对于学生党来说  这个运行速度已经很好了  ，屏幕效果：屏幕效果：高清显示屏 特别舒适 ，散热性能：散热性能：不打游戏 散热还是可以的,3
小巧方便，使用很顺手，指纹解锁非常安全，运行速度快 ，办公使用完全满足，电量续航能力强，总体来说 十分满意，就是不配置鼠标和电脑包。,3
隔天就收到电脑了 很喜欢哦 朋友推荐买的华为笔记本 都是用了好几年都说好用 轻薄小巧 方便携带 运行速度也快 非常喜欢啊,3
抱着试试看的心情，买了这台电脑。不愧是华为的品质。又薄又轻，超出预期。可以翻转180度。整体非常轻薄。,3
运行速度：可以，屏幕效果：好，轻薄程度：重量正好，比较轻，其他特色：运行流畅，平常上班办公完全没有问题，试了一下，可以流畅运行中特效lol，办公轻薄本，就不要去想大型游戏了，总体来说不错，还有鸿蒙的互联体验是很好的。,3
很小巧，很精致，系统是win11，配合一些快捷键的话，操作更方便一些。基本办公足够了，最满意的地方，屏幕可以180&deg;翻转！！！,3
给家人买的笔记本，质感很高级，按键很适合码字，开机两三秒，一直相信华为的品质，wifi敏锐，当时比较了几款笔记本，还是华为轻薄，耐用。,3
太值了这个价位买这个笔记本，完全满足我的办公需要，方便携带，方便办公，颜值也非常高，给了我很大的惊喜。真的是物美价廉。以后还会继续买咱们商店的其他商品。这个笔记本我用着非常的顺手，用着非常的舒服，真的是良心的商品，真的是良心的价格。必须支持。真的是太满意了。,3
长春疫情突发，要封城，孩子还要网课，赶在封城前一天买到了也送到了，太幸福了。机器价格还可以不算太贵，运行流畅，做工很精致。给孩子上网课比平板要好用，因为孩子不会惦记着总想玩儿游戏。,3
外观漂亮，设计符合人体工学。运算流畅，满足办公及基本游戏功能。赞一个！快递小哥也很给力。,3
买的第二台华为笔记本，配合华为手机使用非常方便，系统流畅，工作利器，非常满意，支持华为！支持国货！,3
开宝箱，送货非常快，外观颜色很喜欢，速度也超快，基本满足日常要求，上上网课，看看电影，没问题。简洁大方。,3
这台轻薄本真的够轻够薄，但是电池却很给力～做工精细，是我喜欢的简单大气风～屏幕显示细腻无反光，真的要好好赞！关键是价格便宜！支持国货！,3
华为的产品用的很多了，手机用过5，6个了，电脑，手表，平板，体脂秤，音箱等等，越来越好，越来越漂亮，感觉很好的！！！,3
很不错的华为电脑   选了很久  4000价位左右  主要目的就是上上网课  这个配置够用了  封控期间买的    也不知道能不能发货  还好等了3天  结果发货了  一天就到  很开心  也很庆幸啊  晚一天可能快递就进不来  用了10天了  好用  不错  华为  自营快递给力的,3
最愉快的一次网上购物。当天晚上十点下单，第二天11点就收到宝贝，简直神速，比，自己到市里去购买还快。打开包装，仔细欣赏电脑，精巧雅致的外形，独特的设计，时尚实用的功能，令人爱不释手，孩子非常喜欢。电脑运行速度快，流畅不卡涩。屏幕清晰逼真，色彩艳丽。散热效果更是没得说。希望店家越办越好，生意兴隆。,3
电脑外观颜值高，开机自动安装方便快速。最惊艳的是同步手机操作，一拖快速复制手机文件到电脑，还有华为市场，可以里面下软件方便，就是个放大的电脑，比如剪印是在手机操作的，这个电脑就可以下下来操作，截视频很方便。,3
帮助朋友买的，朋友千挑万选的决策，应该也不会走问题。物流很快，现在已经用起来了。轻便快捷，日常使用的很好的一个配置。，运行速度：挺快的。，屏幕效果：整体不错，清晰。，散热性能：目前没有过热，轻薄程度：很合适,3
运行速度：华为质量没得说，屏幕效果：看图片就知道，很不错的啦，散热性能：轻薄本，散热效果一般不会太差，外形外观：好看好看好看，长到审美上了，轻薄程度：轻薄本，便携性强，够轻薄，其他特色：物流超快，京东自营物流没得说，售后也有保障，nice,3
刚昨天下午下的单今天一早就收到啦！这是一款集轻薄与高颜值于一身的笔记本，拿到手后出乎意料的轻薄，且外观好看，高颜值，作为女孩子的我大爱了！运行速度和各种性能相信华为不会让你失望的！而且价格实惠，性价比很高！值得冲！！！,3
收到电脑还是挺喜欢的，款式简单大方。操作起来也很流畅。我不太懂电脑，一直问客服问题，也很耐心解答。会推荐给朋友。希望之后的操作顺利！！！,3
华为的机子，一直是自己喜欢用的，电脑开机很快，很薄 很小巧玲珑，颜色也是自己喜欢的，东西很好，建议友友们可以入手,3
很好的本子，运行很顺利流畅无卡顿，屏幕视感很舒服。确实轻便实用。用的华为手机配华为本子，多屏协同爽歪歪！妥妥的！,3
这款笔记本不错，运行速度快，开机快，开机用了五六个小时还没发热，支持华为。快递非常快。,3
因为工作原因，用过戴尔、联想、IBM、华硕几款笔记本电脑。三年前买了第一台华为笔记本电脑，感觉很不错。屏幕大小合适，轻薄方便，适合旅行、工作、家用等多种环境。现在入手的是家里第二台华为笔记本电脑，外观没区别，还是微软的WIN系统，挺好。京东快递一如既往地好，快递小哥给力，次日达。,3
刚拆机，触屏用着很流畅，很轻薄，不重，适合日常办公，其他功能还能用，有待使用体验，初印象不错?,3
一直都很喜欢华为的产品，就一直在挑选电脑，最近这一款的性价比很高，符合我的预期，满足我的需求。送货也很快，在春节前到幸福感满满的。就是激活office花了一点心思，和我的华为手机耳机等互联很方便，目前没有用鼠标感觉也还行，等着年后下单一个鼠标?。,3
一直想买个轻便电脑，犹豫买什么品牌，华为手机用着不错，华为企业责任心强，团队给力，电脑一定不错。昨天买，今天到货，打开机器很方便，预装东西够用。喜欢华为，喜欢国货，希望华为一直好。,3
外形外观：很好看 银灰色很高级，轻薄程度：轻薄本 女生用很合适，屏幕很高清  用起来很丝滑  指纹解锁也很方便 总之用的很舒服,3
外形外观：没有破损，轻薄程度：重量很轻，屏幕效果：非常好看,3
呼呼呼挺不错的刚开始风扇声有点大不过是正常的啦!刚开机嘛快递特别快客服也很温柔很耐心的在指导我!特别棒笔记本超好看!入股不亏uu们喜欢赶紧下单吧!??,3
荣耀笔记本升级上来的，就是中了灰色的毒，这个笔记本很喜欢，超级好。反应比荣耀也快一点。,3
疫情期间，安排发货很快，快递也很有保障，电脑保护的很好，正常开机，很满意，按需购买，预装正版office很实用，整体十分满意。,3
京东买的电脑特别快，今天买，第二天就可以到了，而且摄像头很好，保护了自己隐私，需要用时可以开启，不需要时候可以隐藏起来。， 送过来的包装密封很好，摆放也很好。，整体的外观，看起来很高大上，而且质感也不错。，打开电脑，界面也不错，亮度和色彩的呈现看起来很舒服。，购买前浏览了页面，做的画面我不错，配置在也不错，现在刚使用很流畅，慢慢去琢磨。，最后一句总结，值得购买！！！！,3
很好的各方面都挺好，运行速度：不错，屏幕效果：很好，外形外观：好看，轻薄程度：轻薄本，支持国货！！！大学生够用啦！,3
很适合学生，办公学习大小很合适很方便携带，反应很快，运行速度很快，屏幕效果也很好，散热性能也很好，很薄，颜值很高，推荐推荐。,3
挺好的，用着不错，轻便快捷，棒棒的，喜欢的可以购买哦！在疫情前购买的物流也很快，买到了，不错，不错！，外形外观：外观大气，简洁！，散热性能：很不错！,3
京东一直是我最信赖的。可是可是今天收到的华为手提电脑，太惊艳，太惊艳了！选的深灰色，高端大气，比图片好看太多！！开机速度也快，爱了爱了华为，中华人民的大爱！！,3
真的是太太太喜欢了，不枉费等了几天才到，收到太开心了，深灰色颜色超棒很大气 真的是够薄哎，开机速度很快，用的手机也是华为的，现在佩奇了 操作WIN11需要再摸索摸索，总得来说太赞了，喜欢喜欢?,3
外壳颜值高 体积小轻便 屏幕大下巴 别的都挺好 开机速度特别快 3秒左右 键盘用着挺舒服 可以语音阅读 语音输出 摄像头挺特别的 买个架子 拍摄角度可以再舒服些 华为生态流畅 我还是挺喜欢的 挺喜欢的 挺喜欢的???,3
这款华为笔记本电脑的性价比很高，质量很好，价格实惠。这款产品有高色域护眼炫光屏，对眼睛有好处，可以缓解长时间办公眼睛疲劳。可以和很多设备连接在一起，使用起来很方便。颜值很高，轻薄金属机身，看起来很好看。携带起来也很方便。另外，京东的送货速度很快。总之，我非常喜欢这款产品。,3
疫情期间收到货品，迫不及待的使用了。外观精致，整体看上去大气。关键还不重。主要用于办公及学习。存储够大。非常棒。系统是win11，还在摸索中。Office已经装好了，但是后面会考虑升级到家庭版，这样家庭成员都方便使用呢。,3
真的超级好看(??&omega;??)??！！！Office也不用自己买，只需要激活就行，和我的平板联机真的很棒，就是相机有点鸡肋?但是也确实是为了保护隐私选的，不错子(*?&acute;╰╯`?)?,3
刚到，迫不及待来评价。物超所值，实在是太好用了。速度快的不适应，比我原来的好用太多。重量很轻，开机速度超级快，总之三个字：很满意，愉快的一次购物。,3
京东的送货速度真的很给力，凌晨下单，下午就收到了，电脑很薄，外观很好看，14寸不大不小，刚刚好，运行速度比较快，深灰色特别好看，很大气，还有隐形摄像头，现在用着还行，总得来说还不错！！,3
外形外观：非常美观，爱不释手，轻薄程度：特别轻薄，很喜欢，运行速度：速度很快，也不卡，很好用，屏幕效果：视觉感很好,3
很好，运行速度：快，屏幕效果：高清，散热性能：高，外形外观：小巧玲珑，轻薄程度：很薄，方便携带，其他特色：实惠的一次购买体验,3
很不错，异地调货还送的很快，京东物流不错的。华为电脑也很好看，冲着颜值去的，拿到手一打开，满满的科技感，按照提示操作，很简单就设置好了，支持华为。,3
整体很有质感啊，第一次接触win11，感觉洁面还有点像ios系统。整体运行流畅，对得起这个配置，然后摄像头隐藏在键盘里，感觉好新奇?。指纹识别特别灵敏，比起以前开机输密码简直好得不是一点点。自带华为应用商店，下载软件也不用担心有奇奇怪怪的绑定和插件那些，非常省心。收到货就搞活动降了一百，然后申请保价享受了同样的优惠，京东，华为，值得信赖！,3
第一台华为笔记本。拿到后惊喜惊讶。高科技，隐形摄像头，运行速度快。轻薄，很方便携带！屏幕看起来很舒服。,3
对比了很多款，还是觉得新上市的这一款性价比较高，最终还是选择了华为这一款。外观很漂亮，比较轻薄，经济实惠。物流也比较给力，昨晚发货今天中午就收到货，用了觉得好再追评。,3
由于家里人也都一直都在用华为手机，也用过苹果、华为iPad，感觉华为品牌、产品都挺好?也曾使用过宏基、联想等手机电脑。这次对比了多种品牌后，还是依然选择继续支持国产品牌华为。这次买手提电脑主要是给小朋友用来上网课和线上考试用，昨晚买单，今天上午就收到了，服务很好，物流很快，开机很快，充电很快，开机后按提示安装也很快，键盘也好用?总之感觉第一次体验用华为手提电脑还是挺好的?希望在以后的使用过程中也会很好，祝华为越来越好???,3
金属机身，手感很好，做工精致，屏幕显示效果细腻，第一次用华为的电脑，在探索中。,3
晚上下单，第二天就到了，到货很快，外观颜值很好，质感也不错，轻薄，很多功能还要在熟悉。,3
小本本非常喜欢，最近孩子居家学习，用这个本子非常合适，，运行速度：很快，屏幕效果：非常清晰，散热性能：机身完全没有过热现象，轻薄程度：方便携带轻薄高颜值,3
送货速度很快。华为大品牌，值得信赖，，运行速度：快，屏幕效果：清晰，散热性能：良好。,3
