信号不是很好，运行还可以 ，没更新系统的时候卡屏，待机时间对我来说还可以因为工作忙一天一冲也OK，充电要两个多小时才会百分百,2
还可以用着顺手因为一直用iOS系统.就是确实电池一直不经用.手机还会发烫.其实本来是买11的.购物车里点错了没注意.55555.....,2
用了这么多天，感觉还可以吧，毕竟没出现什么问题,2
10月底新产的，然后除了夜拍还不错以外，其他的很一般。,2
用了十天信号弱，还没有XR的信号强。电池日常和以前一样用，持久性与用了两年的XR差不多。,2
华为没有卖，只好买了。，外形外观：一般般。，拍照效果：好。，运行速度：很好。,2
手机第二次购买了，物流很快，拍照效果也很好，还是很不错的,2
大小合适，性能强劲，重量相对轻，手感挺好。，屏幕有点绿，开5G续航尿崩，一些软件卡顿。,2
外形外观：外观比较妥，屏幕音效：中规中矩，拍照效果：苹果的优势吧，运行速度：可以，待机时间：不怎么行啊,2
对于外观，我还是比较满意的，拍到了我喜欢的颜色，我还会再买的。,2
手机还可以，打游戏热，掉价太快，入手六千，第二天掉四百，真**坑,2
不想说，苹果12买成6800，现在苹果13最高的内存256的也是6800，亏啊,2
手感都还不错，速度可以，像素稀松平常。电池一大半刷视频基本三小时关机。,2
手机背后有透明气泡，因为在背后，所以没注意，不影响使用，但是对于完美主义者，总觉得有瑕疵,2
用起来很好， 电池用了几天感觉没有刚买回来那会耐用了打盘10多分的王者需要12格电  选的快充头套餐很好基本90分钟充满。,2
外形外观：紫色还不错，屏幕音效：挺好，待机时间：电量?用的比较快,2
用时间长了会发热，无线充电也发热，冬天用好，暖手宝,2
用了一天，目前没有什么问题，就是快递包装很不好,2
刚7天就降价，还不给保价，要精确到秒，手机还是不错的，速度和手感都很好，就是价格变动的让人接受不了,2
手机很热，刚拿到没有30min，简单操作一下 手机很烫,2
物流超快，用起目前还没发现什么问题，只有用一段时间才知道,2
外形外观：好看，拍照效果：高清，是我喜欢的一款手机,2
一共买了两部，一部安全下车。一部绿屏，因为正常情况下绿屏很轻微就算了.希望后期不要出问题吧.,2
该有的毛病一个没落下 希望新系统能改善这些毛病 目前没发现别的毛病 发现了再说,2
手机还不错，就是刚到手，就降价，双十一才4799，大家参考一下价格,2
只是比苹果4大了几倍而已，不知道评论蓝色好看的是不是拖。    参考评论买了蓝色，太菜了，也没法调换了。,2
完全是因为买不到华为才买的12，说不上喜欢，外形外观：一般，屏幕音效：很好，拍照效果：很好，运行速度：快，待机时间：中度使用一天两冲,2
手感不错，拍照也清楚，音质也好。主要功能不太行，信号不太好好；同一张卡信号比安卓机差。,2
总体还行，本来想买白色 但是买的时候快充套餐白色得加109元，现在紫色出来了 白色就只加9元了 失误了,2
手机用着可以，不过手机盒子磨的很粗糙，感觉剩了好久,2
还好一般般吧，运行速度：一般，拍照效果：一般,2
原本以为换个新手机电池会耐用一些，电池还是不行，其他的都挺好的,2
8换的12 确实顺滑 也很好看 就是 确实容易烫 和用了三年的8差不多烫 ，确实是一个bug,2
买给家人用，看上去不错，就是充电器会过热发烫，性价比一般,2
童女童了一下自己喜欢?！没事不要打电话让自己开心起来就是这样简单粗暴执法的时候都可以直接说,2
整体还行，不过语音助手不是很灵敏，音量可以，但音质不行，运行速度可以，但是电量不足，用5G网络耗电更快。,2
外形外观：外观漂亮轻薄，屏幕音效：音质不错，拍照效果：日常用可以，，运行速度：飞快，待机时间：拉胯，续航只能说太垃圾,2
手机不错，就是刚买就有***，竟然还不能价格保护，坑啊,2
苹果信号一如既往的差，嗯，但是系统流畅，买给父母用还是可以的。,2
外形外观：黑不拉求的，不推荐黑色，拍照效果：是要比上一代好一点，运行速度：祖传，待机时间：感觉费电,2
外形外观：用长了时间会发热，新手机不知道为什么会这样，运行速度：其他还行,2
6.1下的单，保修期到明年5.31，算是翻车吧，只是其余的没问题，不想麻烦就没管了。,2
第一次在网上购买，也是看评价才买的，质量还不错，也很便宜，有需要的朋友可放心购买，但是，感觉这个系统的面部识别很不灵敏，录进去面部信息之后，再解锁就很不方便的。,2
烫，玩游戏烫，快充也烫，应用开多了也烫,2
第一次用苹果，上5G网络和wifi下载对比安卓有些慢，总体感觉还可以。,2
外形外观：可以，手感可以，大小可以，性能可以，屏幕拉胯,2
绿色挺好看的，反正就还可以吧，没有绿屏的情况，，但是拍照好像是有点子 锐化 发黄啊 （裂开,2
很棒下次的，外形外观：外形尺寸不错，屏幕音效：不错,2
耗电要比以往型号快。之前刚用xr时基本一白天不用充电。12用不了这么久。其它还行，没感觉什么特别,2
都挺满意，除了一点：夜间拍照经常有光斑，还以为是UFO ，我的华为p30拍照就好好的。,2
建议大家还是在实体店购买！方便售后！，手机一度出现问题，打电话对方听不到声音；其次在编辑文件和数字时，想在数字中插入鼠标键是无法准备插入中间,2
外形外观：还行，屏幕音效：可以，拍照效果：可以，运行速度：可以，待机时间：一天一充，其他特色：充完电会卡卡的，网络也时不时用不得，有4G也一样,2
其他的还行，外观好看死了。超适合女生用的白色，但是感觉续航一般，看视频三个小时就没电了，听筒声音不是很清晰，用户体验中等吧！！！！！,2
买完降价了，找客服保价很快处理好。iPhone转安卓又转iPhone，只是为了给我女儿拍照。手机真心没有很好用，比起安卓，很多方面都很不智能,2
还行，这是换货后的产品，用几天再评价，谁知道会不会又出现手机故障,2
速度没得说，很快。就是网路不太稳定，时好时坏，续航没试，正常用的话，感觉应该能用1天。,2
手机很顺畅，外形外观：有点不满意边框有刮花痕迹一道，特别堵心，其他的还好,2
外形外观：可，待机时间：12容量看过视频的都知道待机一般，其他特色：轻啊。晚上砸脸都不疼，5G模式耗电是真不行,2
红色乃国色，但是因为骚气外观，导致市场突变，大家都爱上了紫色，跟我一起，呼吁保护红色，从我做起,2
流畅度可以，拍照也比较清晰，但是续航能力差，上午听会歌，就30%的电没了，还有信号不稳定,2
一般般吧，屏幕有点小，电池待机的时候还行，用的时候真的是崩了。发热也挺大，其他都挺不错的。,2
未激活的手机，拆开检查卡槽上端有一个瑕疵磕伤(我是很小心的拆开的哦)，不是很完美，12还是很漂亮的，手机就是用来用的，也不想找客服了，刚激活完成了,2
第一次到线上买手机，感觉还算可以的吧，目前使用起来也还可以.,2
跟舍友一起买的，三台都出现绿屏，都是LG的屏幕，不过后面也有解决方案，态度也还不错！,2
后悔激活了，屏幕偏黄，拍照拍灯有颗小影子，手感说真的没有现款安桌机器好，充电方面就不提了差距，苹果系统的使用还是可以点个赞的,2
外形外观：是原来喜欢的白色..，？半个小时之内突然黑屏四次是个什么意思？？难道就因为我后台放学习通？和学习通相冲？？？？??,2
这手机适合冬天用，可以当暖手宝，冬天也不需要男朋友的温暖了。机身小，适合我们女生吧，用一段时间就习惯了吧。,2
送货速度非常快，上手后试了一下先，外型还是很好看的，而且音质也非常棒，拍照效果感觉非常好，尤其一直觉得京东的物流配送速度非常快，一直支持信任京东，用了好几年苹果手机，相信这次也不会让自己失望。赞一个，只是没有耳机和充电器，有些遗憾。,2
手机用着还不错，不过手机信号这个硬伤太硬了，硬的我都看不到其他优点了。,2
其它什么都可以，就是这个拍摄视频不怎么清晰，没有XR的清晰,2
外形外观：大气上档次，墨绿颜色不错，屏幕音效：声音干脆，拍照效果：清晰，运行速度：快，待机时间：满足一条需要，其他特色：没有充电头，再花100多，差评,2
外形外观：还行吧，屏幕音效：还可以，拍照效果：勉强凑合,2
一直想买台iPhone，终于如愿了，可惜有点不尽人意，发烫，贼烫的那种！逼得我充电还要垫张湿纸物理降温！一样东西不送！物流速度倒是很快，配送员态度也不错，勉强给个中评,2
很流畅，但信号是硬伤，用了高通基带，和11好不到哪去！,2
外形外观：12外观挺好看的，拍照效果：还可以，清晰，待机时间：需要随身携带充电宝/充电器？，，屏幕音效：发黄是真的关闭原彩也有点黄但还能接受,2
手机用着该可以，就是偶尔死机，电池是硬伤。用蓝牙耳机听歌，会有串歌现象，除了5G，没11好用,2
颜值高，手感很好，大小合适，电池不耐用，信号不好,2
手机总的来说不错 但是回收手机的小哥 抓住你想要手机心理 使劲打压你原有手机的价格 人家就靠这个吃饭 没办法,2
还行吧  就是手机容易发烫  前几天买的时候5408现在降价到4908了,2
续航能力不行，两千多容量，比上一代弱，特别是开5G耗电加快，开5G信号有时只有两三格,2
外观挺小清新，但屏幕真的很黄，没贴膜，跟小七屏幕颜色对比如下买回来只充过一次电，发烫,2
东西是好的，但是我刚打开，后壳有很清晰的指纹，就很无语?,2
手机外观不错，因为不喜欢特别大的手机，这款刚刚好，但是触屏不是特别灵敏，耗电也快，总体用着一般,2
手机固然不错，但其他方面做的真的一般，除了圈钱还是圈钱。手机充电头，数据线，迫使你买新的配套的头子，耳机也没了。,2
外形外观：买的白色不好看，屏幕音效：一般，拍照效果：黄，运行速度：还可以，其他特色：没有，看别人抢也抢了一个，买回来丑爆了不喜欢,2
还没我OPPO好用呢,2
外形外观：外形还可以，挺轻的，屏幕音效：一般，拍照效果：很苹果，运行速度：不知道是我网卡还是手机问题，有时候刷新不出来，待机时间：还可以，其他特色：手机没有膜，全是指纹,2
手机还可以，就是价格波动有点快，1号买的4999，说是价保双十一，好像没保持好，保到11号，成了4799,2
除了有时候会断网、必须重开机才恢复还有电不经用的话暂时还没什么问题,2
手机打开盒子有细微的灰尘，不知道是什么原因 手机质量序列号都查看了目前没什么问题，就是买的原装充电头还没有到，手机没电了，看后续用有什么问题再来评价吧,2
手机降价好快，11月11日是6208元 12月8日 是5868元 苹果12机型 256G版本，双十一未必就是最便宜的购机时间哦,2
手机还可以，全新未开封。，物流配送虚假信息。信息显示配送中，打电话问地点准备自取（因为急着回乡过端午)。结果回复货物还未分拣。,2
我没想明白这个充电器咋用。是我太落后了？手机挺好的就是拍照对光拍有绿点,2
电池掉电很快，感觉电池跟不是新的一样，另外物流还是蛮快的，小哥冒着冷风送货辛苦了,2
外形外观：外观还行吧，屏幕音效：音效也可以，拍照效果：拍照像素不错，运行速度：运行速度的话有些软件也会闪退，待机时间：待机感觉真心不行啊 手机会发烫。充满电放一晚上掉百分之十，其他特色：颜色是自己选的没得说,2
是正版，但啥也没送，而且还要单独购买充电器，感觉又亏了，早知道买华为了，待机时间：不是太久，运行速度：还行，外形外观：不错,2
外形外观：我的天啊，买了就后悔，摸上去很涩的感觉，不顺滑，背面感觉像塑料，当初买8的时候拿到手超级惊艳，这个感觉掉档次，屏幕音效：屏幕发黄，不过挺灵敏，识别也快，拍照效果：这个没得说啦！,2
手机的手感确实很好，但是不存电，快速打字的时候会有卡顿，这个我非常接受不了，其他的和苹果11都一样，没啥区别,2
外形外观：美，运行速度：快，拍照效果：好，屏幕音效：好，待机时间：短，其他特色：信号太差啦，拿在手上跟砖头有的一拼,2
掉电是真的快 买了一个多月 两点半睡觉的时候81的电十点半醒发现手机就剩13的电,2
iPhone12续航确实,2
618可以很优惠有充电器的5800，很好，朋友介绍私人店都要5700，最终选择京东，相信京东。5800值了，唯一的遗憾没有手机套，没有耳机。,2
整体使用感还不错吧！反应很快！就是拍照确实很黄，电池还可以，偶然有卡顿情况，最无语的就是买完两天就降价了，一个月内将价好几次，现在6月价格更低了,2
还可以吧，主要为了5G换的，手机玩会儿游戏看会小说就发烫，这点比11差多了，冬天放个暖手宝不错，夏天感觉会完蛋???,2
用的还行，老婆用苹果习惯了，要不然就换华为了，不配充电器的苹果，呵,2
东西还是挺不错的，个人也很喜欢，双11期间买的，便宜了不少，虽然13都出来了，但我还是觉得12也很不错，爱了。,2
物流很快凌晨两点下单下午收到的，运行是流畅，但是存在两个问题，1、充电的时候看看头条也发烫，2、玩王者荣耀的时候烫手。我的8p用了快四年了都没这个现象,2
外形外观：膈手，屏幕音效：还行，拍照效果：好，很赞，运行速度：一个字，快，待机时间：一般，其他特色：一般，面部解锁有时候不灵敏,2
屏幕音效：音响不行，跟安卓一样，噪音很多。，运行速度：一个星期都没用卡三次？死了一次机。，外形外观：外观挺漂亮的。，拍照效果：拍照也很好。,2
外形外观：手感很好  轻薄，运行速度：运行很流畅 我是把xr数据直接转过来的  打开app明显变快了，其他特色：卡针不是原装的，屏幕音效：从侧面看会有些发绿  其他没问题,2
挤牙膏式的性能提升。，信号增强有限；，电池容量轻度使用的条件下才能勉强一日一充；，外观尚可，拍照尚可；，发货速度比预期快（原本预定11月24日前发货，实际提前了差不多一周），不配耳机，充电头且价格比较高的情况下性价比偏低。,2
对产品质量有点担忧，序列号F开头，本是京东的拥护者，这一次买的很糟心！希望售后能做好，否则真的以后会选便宜的PDD,2
颜色方面还好，摸起来手感一般，配置简单，总体而言一般，不算很好的一次购物,2
外观挺好看。手感也可以了。买回来三天就出现了卡屏现象无语了?,2
照相功能没有以前强大了，整体还行，买给老婆的，他在用拍不了产品照片。,2
12的信号简直一绝，在家里各种断WiFi，而老手机苹果8还在放视频,2
续航扣分，玩游戏就是个暖手宝，系统流畅性满分其他都在预期之内,2
外形外观：非常赞，运行速度：非常棒，待机时间：就这项，是真想吐槽下，待机时间太差了，虽然买了快充，依然充电和国产品牌没办法比，用的快，充的慢。,2
外形简洁美观，做工精致，运行速度不错，待机时间真心一般，信号也一般。喇叭音效共鸣大。拍照效果提升不明显。,2
不错不错 但是总感觉像素哪里怪怪的 而且真的刚买两天 掉价就很厉害！真的乌鱼了 就很不李姐！,2
网速好差啊，没有我之前的的手机网好，没怎么见它信号满格过??,2
还可以吧，还行，怎么说呢？背后很好看，这前面的话我觉得白色应该还是要用白色的，后面是白色，前面是黑色，总感觉好像带了个壳一样，唉，就这样吧,2
外形外观：漂亮，红色不耐看，建议还是黑色或白色，屏幕音效：很好，拍照效果：很好，运行速度：强悍，待机时间：不咋滴，其他特色：信号差到无法忍受，一直以为我房间信号问题，结果朋友的华为手机来我这里满满的5g信号！,2
外形外观：外观漂亮，屏幕音效：屏幕色彩准 音效还行，运行速度：运行速度快 ios常规，待机时间：手机耗电快 易发热 夜间待机掉电严重 玩游戏时耗电且发热 发热后会出现掉帧,2
目前来看拍照我觉得不好看，追剧的音质很好，就跟带了耳机一样,2
整体还行，就是信号真心不稳定，用网络数据流量的情况下经常断连，???,2
快充套装也是绝    手机到啦充电头才慢慢发货等了一个星期拿着个空手机也就只能哈哈哈?,2
第一次评价 买个苹果 X胖就当备用了 12感觉一般 电池比xr还不经用,2
双十一买的，感觉活动力度不大，确实比平时便宜些，但是优惠力度远小于以前了，就这样吧，手机是没问题的，京东送货上门很方便，点赞,2
京东配送就是快，每次都是充电器跟手机分开，好烦啊！其他都好，各种服务也快，这次购物体验差了点。,2
待机时间：电池真的拉垮，今天刚到去实验室之前40，一个小时后36，期间除了看消息没有做任何事，其他特色：边充电边打视频，手机成功成为暖手宝。正好天气慢慢冷了，妈妈不用怕我受凉了?,2
物流很快，昨天下单，今天就收到了，但快递小哥的服务太垃圾了，电话也不打直接放保安室，而且直接给我签收了,2
第一次充电的时候会发烫的，把我吓到了，感觉一般，但是有优惠的时候跟朋友一起抢够的，大概还行吧，毕竟要换手机，性价比还可，拍照效果给大家看看,2
很少会在京东买东西，真的没想到买个五千多的手机包装这么简陋，里面的泡沫都焉了，手机目前没什么问题,2
256的没货买了128的，回来就后悔了，完全不够用。电池用起来给我的感觉像是用了两年的一加7P的电池。外观没得说确实好看但是用起来手里拿着很硌手。整机重量也很轻，这点挺不错。,2
一波三折 但最终还比较满意。手机相较于同价位安卓手机一点也不香了。特别是续航方面， 这就和车子一样国产车起来了，合资车就得降价。这也可能是我最后一步苹果手机了,2
运行速度：发烫就掉帧而且发烫起码47以上烫手，不打游戏的话就日常使用还行吧,2
网上朋友聊到的翻新机让我遇到了，真是汗颜呀。作为京东的资深网购支持者，钻石用户也可以忽悠实属天坑。，1、手机充电口底部均有堆积漆状；，2、手机听筒左上角有掉漆现象；，3、拆开手机10分钟内完成的事实陈述。，请京东官方给出合理的解释及解决方案。,2
手机不错，换手机的小哥哥检查手机很认真。下午的时候库乐队还能用，到了晚上库乐队竟然用不了了，也是奇怪,2
外形外观：外观好看，屏幕音效：没问题，拍照效果：可以，运行速度：不知道是新手机软件适配不行，还是怎么，有时候会莫名打不开软件，绝对大实话，待机时间：正常,2
偶尔会有点卡，得重启机子才能打开软件，别的都挺好的，一直用的苹果，系统确实好用。,2
挺好用的比安卓用起来舒服，就是续航不怎么行，打游戏或者视频会发热,2
用着还可以吧，电量马马虎虎-信号是真的不好，还没我6S用着快.唯一比6S占优点的就是内存大了哈哈哈?哈哈哈实话实说哈！要不是我6S实在是用不了了，我还真不打算买12,2
苹果12很轻，比11轻很多，没质感，反正我不太喜欢。，改成了直角边，但是已经没了5s的那种精练的感觉。，蓝色还行，但是没有我11的绿色好看哈哈。,2
外形外观：还可以 有点深，屏幕音效：有点发黄，拍照效果：还好，运行速度：有卡顿,2
价格别人买成4599，我买成4799，都是plus会员，区别对待，三星评价吧，感觉开不开会员都一样,2
用了半个月不到，面部ID使用不可用，退回去换新，希望换的这一台手机能好好的，别的不说，京东的服务态度还是不错，退货，咨询客服回复的都挺快！,2
颜值真的超级高，手感很喜欢。但中间出现一些问题，也退回检测了，最后检测没问题。使用中出现的现象就是视频通话的时候手机温度会升高，非常烫手，不明白为什么。,2
信号一般在同一个地方总比安卓机少那么一格信号，30度室温玩了两局农药发热量跟888有得一拼，只是看上了水果的文档扫描拍照，这个确实比安卓机好用,2
用了两天才来评价，正品包装。拿到的时候包装完好无损，颜色比图片上好看，手机也查了是正品，感觉有点轻，朋友也说比他的轻点。有时候触屏不太灵敏，需要使很大劲，点好多下，手和手机也都没沾水。别的都还行,2
就那样，还是习惯用安卓，等等再买个安卓，这手机还是用不惯拍照只有五倍变焦,2
外形外观：外观感觉就是苹果四的感觉，就是比苹果四大一点。，屏幕音效：音量感觉还可以吧。没啥说的。，拍照效果：还没试。，运行速度：快，待机时间：待机时间太短。真的太短。太短了。,2
用了几天  12很小巧很秀气 ，比11还要小一点点，续航不怎么样，虽然电池是百分百，但是掉电还是挺快的,2
5**芯片还是发热严重呀，玩一些普通app还好，一些需要性能的app就手机发热感觉快要爆炸?,2
手机用了两天还可以吧。毕竟去年的机器了，没什么问题。就是客服啊，遇到问题不能及时解决，说第二天让技术人员联系我也没有联系，后来是自己百度解决的。,2
20天的时候发现屏幕上有一道小白痕，之前没怎么注意，返厂要7-14个工作日，现在用的备用机，好惨，大家收到货之后一定要仔细检查。,2
其实买苹果12是为了多用几年，我的Se 6S都能用（屏蔽更新都是老版本），看苹果5G第一部就买了，要外观还是安卓机的屏形好看，苹果大黑边依然不好看。，运行速度：这个可以，比老机器快很多。,2
不粉不黑，我一直追求性价比用过锤子，联想，小米，感觉都不错。媳妇儿一直用的苹果，上个7plus用久了电量不耐用，也有时卡顿，所以换了12，  现在跟我反应说新手机已经出现过好几次卡顿了，没7p顺手，还有一次莫名没有了声音，重启才好的，苹果这么贵该反思了。主要现在在好多使用方便性上和国产机也差的好远,2
一半给手机好评  一半给店铺搞饥饿营销好像是赚了有600元的券实际买完就降价  什么鬼  快递包装也很简单  连膜也没有贴一个  简单的手机壳也没有  送货速度还是挺快的,2
感觉苹果12玩个十几分钟就开始发热了，又不是小米，怎么这么快就会烫，还有充电的时候也是，充电器也会很烫。  其他感觉还可以，毕竟是新机，运行速度也不错,2
外形外观：跟5s一样的外观设计，玻璃后盖沾指纹。，屏幕音效：屏幕比苹果11的清晰，挺好的。，拍照效果：拍照变化不大，我感觉一直都挺好的吧，平常人也看不出什么细节的变化。，待机时间：我已经用了一个多月了，待机时间减少了很多，没有11的电池耐用。区别挺明显的。,2
外形外观：还是勉勉强强接受蓝色，但是个人认为性价比不高，作为一个国际大牌及中高售价颜色还不能让人满意，屏幕音效：显示目前不错，音效还要再用用看，拍照效果：比较少拍照哈哈哈，运行速度：运行方面还是可以的，待机时间：续航是有所下降.这方面也是一般般，其他特色：更新打游戏会有发热现象,2
可以说是比较糟糕的一次购物体验，为什么为什么为什么这么说呢？买了之后没几天降价三百元。多次咨询客服无果。价格确实是个大问题。，说到手机：手机确实没问题，也一直在这家店买。，外形外观：还是很漂亮的，很轻，抓握起来比较舒适；，屏幕音效：屏幕方正，略比之前用的XR小点；，运行速度：运行还是可以的。,2
手机用着暂时还不错，就是套餐里有什么东西也不写清楚，害我还得重新买个充电头,2
